VALENTIA II PRINTED LEATHER WRISTLET,$119.00,Make your next escape with this exotic wristlet from Patricia Nash. The organized design flaunted a tooled sunflower design.
MERCER PEBBLE LEATHER COIN PURSE,$58.00,Petite chic—MICHAEL Michael Kors' charmingly compact Mercer coin purse packs plenty of sleek personality (and slots for your most-needed cards) in gorgeous pebble leather. An RFID lining helps to resist electronic scanning of your cards.
"COATED CANVAS SIGNATURE REXY AND CARRIAGE ROUND COIN CASE, CREATED FOR MACY'S",$65.00,A whimsical rainbow accent puts a carefree spin on COACH's Signature Rexy And Carriage coin case.
KARLA LEATHER WRISTLET,$58.00,A must-have addition to any collection. This essential wristlet from Michael Michael Kors flaunts polished hardware.
KARLA LARGE TRIFOLD WALLET,$128.00,A touch of edge. This wallet from Michael Michael Kors features plenty of compartments and card slots to keep your currency and cards organized and in place.
POLLY CARD HOLDER,$58.00,Travel light while staying organized with the minimalist kate spade new york Polly Card Holder.
LEATHER WIZARD OF OZ ROUND COIN CASE,$65.00,A classic accessory Wizard of Oz fans will love. This charming style from COACH is crafted from leather.
SKINNY WALLET IN REFINED LEATHER,$150.00,"A slim snap wallet from COACH holds an ample selection of pockets inside smooth, refined calf leather with a luxurious hand feel."
LEATHER LEE CARD CASE,$38.00,"Go minimalistic and chic with Fossil's Lee card case, ready to hold your essentials in slim, casual-cool style."
BURGESS COURT WRISTLET,$88.00,Indulge in some serious sparkle with Kate Spade New York's ultra-chic Burgess Court wristlet.
MERCER PEBBLE LEATHER MULTI FUNCTION PHONE CASE,$118.00,"Keep your tech, cards and cash stylishly together with MICHAEL Michael Kors' multi-pocket Mercer zip wallet, crafted from textured leather and featuring a thin RFID lining to help prevent electronic pickpocketing."
LIZARD EMBOSSED LEATHER SLIM CARD CASE,$50.00,"Crafted from supple leather with a lizard-embossed print, the streamlined silhouette of this chic card case from Lauren Ralph Lauren is finished with signature ""LRL"" hardware."
ADELE DOUBLE-ZIP IPHONE 7 PLUS WRISTLET,$118.00,"Effortlessly organize your cards, cash and smartphone in the contemporary-cool style of this sleek zip wristlet in rich leather from MICHAEL Michael Kors."
REXY AND CARRIAGE ZIP CARD CASE,$65.00,"Modern meets classic, with a touch of wit, on the COACH card case with Rexy and Carriage. It features a fun dinosaur and carriage motif."
REXY AND CARRIAGE COIN CASE,$65.00,"Modern meets classic, with a touch of whimsy, on the COACH coin case with Rexy and Carriage. It features a fun dinosaur and carriage motif."
CONTINENTAL WALLET IN REFINED LEATHER,$225.00,Unique and ample pocket options fill a COACH zip-around leather wallet marked by a signature horse-and-carriage logo in polished gold-tone.
"GIGI LEATHER ENVELOPE CARD CASE, CREATED FOR MACY'S",$48.00,"A sleek front logo graces DKNY's Gigi envelope card case for an easy, chic way to tote your essentials."
GLITTER LEATHER ID MINI PURSE,$65.00,"Decked with shimmering details, this ID pouch makes a wonderful gift. COACH's design is crafted from leather."
JULIA SOLID NYLON ZIP WALLET,$68.00,There's a place for everything in the Tommy Hilfiger Julia Solid Nylon Zip Wallet showcasing tons of interior pockets and credit card slots.
LOGAN LEATHER ZIP AROUND CLUTCH,$78.00,A perfectly portable design ready to organize your everyday. Meet Fossil's zip-around clutch.
ICONIC RFID PASSPORT WALLET,$50.00,This adorable design is truly the cat's meow! Vera Bradley's Iconic RFID passport wallet holds all your travel-ready necessities to jet set in purrrrfectly organized style.
SLIM CONTINENTAL LEATHER WALLET,$158.00,"A luxe leather design ideal for the everyday. Kate Spade New York's Continental wallet holds the cash and cards you need, while keeping it sleek with a zip-around closure and gold-tone hardware."
JET SET TRAVEL CONTINENTAL WALLET,$168.00,"On-the-go yet ever glamorous, the Jet Set travel wallet from MICHAEL Michael Kors keeps your financials and phone right at your fingertips."
RFID BLAKE SMALL FLAP WALLET,$54.00,Keep your essentials in the sleek Fossil RFID Blake Small Flap Wallet.
"SIGNATURE CONTINENTAL WALLET, CREATED FOR MACY'S",$138.00,"Pair this continental wallet with any Dooney & Bourke bag for a chic, coordinated set that's functional, too."
GLITTER DOUBLE STICKER POCKET,$28.00,Give your tech a glitzy makeover with Kate Spade New York's glitter double stick pocket that'll hold your card necessities with ease.
MARGAUX PEBBLE LEATHER BIFOLD WALLET,$98.00,Stay organized in sleek designer style with the beautiful kate spade new york Margaux Pebble Leather Bifold Wallet.
COATED CANVAS SIGNATURE REXY AND CARRIAGE ZIP CARD CASE,$65.00,A whimsical rainbow accent puts a carefree spin on COACH's Signature Rexy and Carriage card case.
SYLVIA SMALL LEATHER BIFOLD WALLET,$98.00,Clean lines and a streamlined interior make the kate spade new york Sylvia Small Bifold Wallet ideal for everyday organization.
WIZARD OF OZ LEATHER WRISTLET,$85.00,Oh-the-go style with a theatrical touch. This petite wristlet from COACH features Wizard of Oz detailing and a detachable strap.
CROC-EMBOSSED LEATHER ZIP WALLET,$95.00,"Designed with a compact silhouette, this stylish zip wallet from Lauren Ralph Lauren is crafted from supple cow leather with a crocodile-embossed print."
"REXY AND CARRIAGE WRISTLET, CREATED FOR MACY'S",$85.00,"A cute dinosaur print and convenient, detachable wrist strap put an effortlessly fun spin on COACH's Rexy and Carriage wristlet."
LOGAN LEATHER TAB CLUTCH,$68.00,A perfectly portable design ready to organize your everyday. Meet Fossil's Logan tab clutch.
BURGESS COURT SLIM BIFOLD WALLET,$98.00,Indulge in some serious sparkle with Kate Spade New York's ultra-chic Burgess Court bifold wallet.
COLORBLOCK SIGNATURE WALLET,$165.00,A pop of color adds a fun twist to the gorgeous logo-detailed COACH Colorblock Signature Wallet.
KARLA LEATHER WRISTLET,$58.00,A must-have addition to any collection. This essential wristlet from Michael Michael Kors flaunts polished hardware.
KARLA WRISTLET,$58.00,"Perfectly petite, this pouch from Michael Michael Kors is crafted from leather with a detachable wristlet strap."
BURGESS COURT CARD HOLDER,$58.00,Indulge in some serious sparkle with Kate Spade New York's organized Burgess Court card holder.
LOGAN LEATHER ZIP AROUND WALLET,$78.00,"Ideal for holding all your necessities, the Fossil Logan Zip Around Wallet features an organized interior and convenient wristlet strap."
KARLA LEATHER TRIFOLD WALLET,$128.00,Signature style for when you're on the go. This wallet from Michael Michael Kors features an organized interior and edgy stud accents.
SMALL SIGNATURE WALLET,$99.00,Stay organized and on task with the chic COACH Small Signature Wallet featuring pops of classic logo print and old brass-tone hardware.
GLITTER LEATHER SMALL WRISTLET,$75.00,"Decked with shimmering details, this wristlet makes a wonderful gift. COACH's design is crafted from leather."
METALLIC COLORBLOCK LEATHER TABBY SMALL WALLET,$150.00,"Chic and compact in colorblocked metallic smooth leather, COACH's Tabby wallet keeps essentials stylishly organized."
WIZARD OF OZ LEATHER RFID WALLET,$75.00,Carry this cinematic treasure with you everywhere! This iconic ID wallet from COACH is crafted from leather.
MARGAUX SLIM CONTINENTAL WALLET,$158.00,"Classic is the name of the game with the sleek, organized kate spade new york Margaux Slim Continental Wallet."
SIGNATURE FLAT CARD CASE,$50.00,Carry your cards in oh-so classic style with the trusty COACH Signature Flat Card Case.
JET SET TRAVEL CONTINENTAL WALLET,$198.00,"Keeps your cards, cash and coins fiercely organized with Michael Michael Kors' Jet Set wallet featuring an easy zip-around entry and streamlined interior."
GLITTER LEATHER ROUND COIN CASE,$50.00,A shimmering essential you'll love to gift and receive. The glitter-accented leather coin purse is from COACH.
LEATHER CROC-EMBOSSED MINI WALLET,$135.00,This stylish continental wallet from Lauren Ralph Lauren is crafted from supple cow leather with a crocodile-embossed print.
LOGAN LEATHER TAB CLUTCH WALLET,$68.00,Keep your essentials in check with the sleek Fossil Logan Tab Clutch Wallet.
FRENCH TAPESTRY LARGE LEATHER COIN PURSE,$39.00,A distinct and demure floral pattern graces Patricia Nash's Borse Coin purse for a timelessly chic way to store your small necessities.
METALLIC LEOPARD SLIM BIFOLD WALLET,$128.00,"Go lovely (and organized) in shimmering metallic leopard, with Kate Spade New York's slim bifold wallet."
SAFFIANO LEATHER ZIP-AROUND WALLET,$98.00,Polished logo lettering marks a sleek and organized Calvin Klein leather wallet that converts to an on-the-go wristlet.
ROSEBUD PRINT LEATHER WRISTLET,$75.00,A blossoming way to carry the valuables. This COACH pouch features a removable wristlet strap.
"SIGNATURE CONTINENTAL WALLET, CREATED FOR MACY'S",$128.00,"Pair this continental wallet with any Dooney & Bourke bag for a chic, coordinated set that's functional, too."
ADELE DOUBLE-ZIP PEBBLE LEATHER PHONE WRISTLET,$118.00,"Effortlessly organize your cards, cash and smartphone in the contemporary-cool style of this sleek zip wristlet in rich leather from MICHAEL Michael Kors."
WIZARD OF THE OZ SMALL ZIP-AROUND LEATHER WALLET,$125.00,"Get swept away to the land of Oz with this authentic wallet from COACH. Crafted from leather, it comes in a box for gifting."
MINI SKINNY ID CASE IN CROSSGRAIN LEATHER,$65.00,Beautiful crossgrain leather imparts a luxurious sheen on a COACH mini skinny case designed to keep your keys and other small sundries secure.
COATED CANVAS SIGNATURE WIZARD OF OZ SMALL WRISTLET,$85.00,Any true fan is sure to fall instantly head over heels for COACH's chic interpretation of The Wizard Of Oz on this logo-detailed wristlet.
